{
  "$schema": "./feature-parity-contract.schema.json",
  "version": 1,
  "generatedFor": "NP-0 action-level parity contract (docs/IOS_NATIVE_PARITY_DEEP_AUDIT_ROADMAP.md) · openWeb snapshot refreshed 2026-08-23 (Attendance/DigitalHome/DigitalInvoices/TradingHome escapes already on main: web-version rows + quick-nav chips)",
  "generatedDate": "2026-08-23",
  "baseline": {
    "sha": "66548124",
    "branch": "claude/ios-native-parity-roadmap-aab64a",
    "iosBuildInGit": 76,
    "iosBuildInstalledSim": 75,
    "webProduction": "https://alma-erp-six.vercel.app (health ok 2026-07-17T08:43Z, environment=production)",
    "apiBase": "https://alma-erp-six.vercel.app",
    "notes": "Route checker at baseline: 69 fixtures / 66 web routes, {native-required:61, temporary-web:5, public-web-allowed:3}. Simulator-installed build 75 recorded from the 2026-07-17 deep audit; revalidate at the NP-9 sim session."
  },
  "surfaces": [
    {
      "id": "AG-01",
      "title": "LIVE Business Monitor — mobile composition",
      "route": "/agent/staff-monitor",
      "priority": "P0",
      "state": "native",
      "plannedPhase": "NP-1",
      "webSource": [
        "src/agent/components/AgentStaffMonitor.tsx",
        "src/agent/components/monitor/"
      ],
      "nativeSource": [
        "ios/App/App/StaffMonitorSwiftUI.swift"
      ],
      "notes": "NP-1 DONE: compact shell, sticky status strip + five tabs, date control under tabs, 96pt floating-control clearance. First-fold visual proof lands at the NP-9 sim session.",
      "actions": [
        {
          "id": "AG-01.shell",
          "title": "Compact LIVE Business shell: status strip + 5 tabs + date/history control",
          "kind": "navigation",
          "state": "native",
          "verify": "NP-9 sim first-fold screenshots (6.1in + Pro Max)"
        },
        {
          "id": "AG-01.firstfold",
          "title": "First fold: title, 4 status chips, tab strip, ≥4 KPIs, ≥1 actionable alert",
          "kind": "read",
          "state": "native",
          "verify": "NP-9 sim first-fold screenshots (6.1in + Pro Max)"
        },
        {
          "id": "AG-01.overlap",
          "title": "Floating Agent control never covers interactive rows on Monitor",
          "kind": "navigation",
          "state": "native",
          "verify": "NP-9 sim first-fold screenshots (6.1in + Pro Max)"
        }
      ]
    },
    {
      "id": "AG-02",
      "title": "Agent Control Center (pause + autonomy + capabilities)",
      "route": "/agent/staff-monitor",
      "priority": "P0",
      "state": "native",
      "plannedPhase": "NP-2",
      "webSource": [
        "src/agent/components/monitor/AgentControlCenter.tsx"
      ],
      "nativeSource": [
        "ios/App/App/StaffMonitorAgentsSwiftUI.swift"
      ],
      "actions": [
        {
          "id": "AG-02.pause",
          "title": "Master pause/resume",
          "kind": "write",
          "roleGate": "owner",
          "api": "PATCH /api/assistant/controls",
          "state": "native",
          "verify": "existing StaffMonitor pause toggle"
        },
        {
          "id": "AG-02.autonomy",
          "title": "Autonomy mode select",
          "kind": "write",
          "roleGate": "owner",
          "api": "PATCH /api/assistant/controls",
          "state": "native",
          "verify": "live control-value cross-check batched to NP-9 owner-approved sim session"
        },
        {
          "id": "AG-02.capabilities",
          "title": "Capability toggles (server-echoed state + confirm)",
          "kind": "write",
          "roleGate": "owner",
          "api": "PATCH /api/assistant/controls",
          "state": "native",
          "verify": "live control-value cross-check batched to NP-9 owner-approved sim session"
        }
      ],
      "notes": "NP-2 DONE: pause confirm-dialog + autonomy segmented + 3 capability toggles, PATCH /api/assistant/controls, server echo only."
    },
    {
      "id": "AG-03",
      "title": "Autonomy SLO surface",
      "route": "/agent/staff-monitor",
      "priority": "P0",
      "state": "native",
      "plannedPhase": "NP-2",
      "webSource": [
        "src/agent/components/monitor/AutonomySloPanel.tsx"
      ],
      "nativeSource": [
        "ios/App/App/StaffMonitorAgentsSwiftUI.swift"
      ],
      "actions": [
        {
          "id": "AG-03.slo",
          "title": "SLO invariants, class rollout/stage/sample/error, degraded warnings",
          "kind": "read",
          "api": "GET /api/assistant/controls?section=slo",
          "state": "native",
          "verify": "live control-value cross-check batched to NP-9 owner-approved sim session"
        }
      ],
      "notes": "NP-2 DONE: SLO invariants grid + breaches + per-class rows + outbox line (GET /api/assistant/controls?section=slo)."
    },
    {
      "id": "AG-04",
      "title": "Per-model toggles",
      "route": "/agent/staff-monitor",
      "priority": "P0",
      "state": "native",
      "plannedPhase": "NP-2",
      "webSource": [
        "src/agent/components/monitor/ModelTogglePanel.tsx"
      ],
      "nativeSource": [
        "ios/App/App/StaffMonitorAgentsSwiftUI.swift"
      ],
      "actions": [
        {
          "id": "AG-04.list",
          "title": "Searchable/grouped per-model state",
          "kind": "read",
          "api": "GET /api/assistant/models",
          "state": "native",
          "notes": "native shows enabled count only",
          "verify": "live control-value cross-check batched to NP-9 owner-approved sim session"
        },
        {
          "id": "AG-04.toggle",
          "title": "Per-model enable/disable",
          "kind": "write",
          "roleGate": "owner",
          "api": "PATCH /api/assistant/models",
          "state": "native",
          "verify": "live control-value cross-check batched to NP-9 owner-approved sim session"
        }
      ],
      "notes": "NP-2 DONE: search + provider-grouped model rows, PATCH {modelId,enabled} with enabledMap echo."
    },
    {
      "id": "AG-05",
      "title": "Heartbeat panel",
      "route": "/agent/staff-monitor",
      "priority": "P0",
      "state": "native",
      "plannedPhase": "NP-2",
      "webSource": [
        "src/agent/components/monitor/HeartbeatPanel.tsx"
      ],
      "nativeSource": [
        "ios/App/App/StaffMonitorAgentsSwiftUI.swift"
      ],
      "actions": [
        {
          "id": "AG-05.timeline",
          "title": "Full wake history/timeline",
          "kind": "read",
          "api": "GET /api/assistant/heartbeat",
          "state": "native",
          "verify": "live control-value cross-check batched to NP-9 owner-approved sim session"
        },
        {
          "id": "AG-05.enable",
          "title": "Enable/pause heartbeat",
          "kind": "write",
          "roleGate": "owner",
          "api": "POST /api/assistant/heartbeat",
          "state": "native",
          "verify": "live control-value cross-check batched to NP-9 owner-approved sim session"
        },
        {
          "id": "AG-05.testnow",
          "title": "Test now",
          "kind": "write",
          "roleGate": "owner",
          "api": "POST /api/assistant/heartbeat",
          "state": "native",
          "verify": "live control-value cross-check batched to NP-9 owner-approved sim session"
        }
      ],
      "notes": "NP-2 DONE: full timeline (limit=20), enable/disable + test_now POST; response feed is the displayed truth."
    },
    {
      "id": "AG-06",
      "title": "Live browser watch",
      "route": "/agent/staff-monitor",
      "priority": "P0",
      "state": "native",
      "plannedPhase": "NP-2",
      "webSource": [
        "src/agent/components/monitor/LiveBrowserWatchPanel.tsx"
      ],
      "nativeSource": [
        "ios/App/App/StaffMonitorAgentsSwiftUI.swift"
      ],
      "actions": [
        {
          "id": "AG-06.stop",
          "title": "Emergency stop/resume",
          "kind": "write",
          "roleGate": "owner",
          "api": "POST /api/assistant/live-browser/watch",
          "state": "native",
          "verify": "existing StaffMonitor emergency control"
        },
        {
          "id": "AG-06.devices",
          "title": "Connected devices/online count",
          "kind": "read",
          "api": "GET /api/assistant/live-browser/watch",
          "state": "native",
          "verify": "live control-value cross-check batched to NP-9 owner-approved sim session"
        },
        {
          "id": "AG-06.screenshot",
          "title": "Latest screenshot (tap-to-zoom/save/share)",
          "kind": "read",
          "api": "GET /api/assistant/live-browser/watch",
          "state": "native",
          "verify": "live control-value cross-check batched to NP-9 owner-approved sim session"
        },
        {
          "id": "AG-06.steps",
          "title": "Live step feed (action/target/state/error/time)",
          "kind": "read",
          "api": "GET /api/assistant/live-browser/watch",
          "state": "native",
          "verify": "live control-value cross-check batched to NP-9 owner-approved sim session"
        }
      ],
      "notes": "NP-2 DONE: devices line, latest screenshot (zoom sheet + ShareLink PNG), full step feed with status/error/time, 2.5s tab-visible polling."
    },
    {
      "id": "AG-07",
      "title": "Monitor five tabs (Overview/Agents/Staff/Feed/System)",
      "route": "/agent/staff-monitor",
      "priority": "P0",
      "state": "native",
      "plannedPhase": "NP-3",
      "webSource": [
        "src/agent/components/AgentStaffMonitor.tsx",
        "src/agent/components/monitor/"
      ],
      "nativeSource": [
        "ios/App/App/StaffMonitorSwiftUI.swift",
        "ios/App/App/StaffMonitorAgentsSwiftUI.swift",
        "ios/App/App/StaffMonitorSystemSwiftUI.swift"
      ],
      "actions": [
        {
          "id": "AG-07.overview",